{
  "schemaVersion": 1,
  "repo": "darkmatter/nixmac",
  "prNumber": null,
  "headSha": "unknown",
  "baseSha": null,
  "workflowRunId": null,
  "attempt": null,
  "lane": "peekaboo-local",
  "scenario": "macos_customization_save_rollback_smoke",
  "runnerId": "macos-e2e",
  "runnerKind": "peekaboo-local",
  "startedAt": "2026-05-06T07:22:27Z",
  "finishedAt": "2026-05-06T07:25:26Z",
  "durationMs": 179000,
  "status": "failed",
  "htmlReportUrl": null,
  "primaryProofUrl": "macos_customization_save_rollback_smoke/peekaboo-e2e.mp4",
  "failureProofUrl": "macos_customization_save_rollback_smoke/failure-1778052303-1778052303.png",
  "failureScreenshotUrl": "macos_customization_save_rollback_smoke/failure-1778052303-1778052303.png",
  "failureVideoUrl": "macos_customization_save_rollback_smoke/peekaboo-e2e.mp4",
  "failureTimestampMs": null,
  "replayCommand": "tests/e2e/run.sh macos_customization_save_rollback_smoke",
  "localReproCommand": "tests/e2e/run.sh macos_customization_save_rollback_smoke",
  "phases": [
    {
      "name": "peekabooProviderFixture: Prepared customization managed-badge fixture, deterministic HTTP provider, completion logging, and mock rebuild flag",
      "status": "passed",
      "startedAt": null,
      "finishedAt": null,
      "durationMs": 0,
      "assertions": [
        "peekabooProviderFixture: Prepared customization managed-badge fixture, deterministic HTTP provider, completion logging, and mock rebuild flag"
      ],
      "proof": [],
      "error": null
    },
    {
      "name": "peekabooProviderLaunch: App launched for Untracked customizations proof",
      "status": "passed",
      "startedAt": null,
      "finishedAt": null,
      "durationMs": 0,
      "assertions": [
        "peekabooProviderLaunch: App launched for Untracked customizations proof"
      ],
      "proof": [],
      "error": null
    },
    {
      "name": "peekabooProviderBuildBoundary: Build & Test advanced to Save step for Untracked customizations",
      "status": "passed",
      "startedAt": null,
      "finishedAt": null,
      "durationMs": 0,
      "assertions": [
        "peekabooProviderBuildBoundary: Build & Test advanced to Save step for Untracked customizations"
      ],
      "proof": [],
      "error": null
    },
    {
      "name": "peekabooProviderSaveFlow: Untracked customizations Save step committed changes and returned to Describe",
      "status": "passed",
      "startedAt": null,
      "finishedAt": null,
      "durationMs": 0,
      "assertions": [
        "peekabooProviderSaveFlow: Untracked customizations Save step committed changes and returned to Describe"
      ],
      "proof": [],
      "error": null
    },
    {
      "name": "Untracked customizations History restore did not return disposable config repo to baseline",
      "status": "failed",
      "startedAt": null,
      "finishedAt": null,
      "durationMs": 0,
      "assertions": [
        "Untracked customizations History restore did not return disposable config repo to baseline"
      ],
      "proof": [],
      "error": "Untracked customizations History restore did not return disposable config repo to baseline"
    }
  ],
  "captureLimitations": [],
  "proof": [
    {
      "kind": "screenshot",
      "path": "macos_customization_save_rollback_smoke/01-customization-launched-1778052183.png",
      "url": null,
      "thumbnailUrl": null,
      "timestampMs": null,
      "phase": "macos-e2e",
      "caption": "01-customization-launched-1778052183.png",
      "isPrimary": false,
      "isFailureProof": false
    },
    {
      "kind": "screenshot",
      "path": "macos_customization_save_rollback_smoke/01-customization-launched-1778052183_annotated.png",
      "url": null,
      "thumbnailUrl": null,
      "timestampMs": null,
      "phase": "macos-e2e",
      "caption": "01-customization-launched-1778052183_annotated.png",
      "isPrimary": false,
      "isFailureProof": false
    },
    {
      "kind": "screenshot",
      "path": "macos_customization_save_rollback_smoke/02-customization-popover-1778052240.png",
      "url": null,
      "thumbnailUrl": null,
      "timestampMs": null,
      "phase": "macos-e2e",
      "caption": "02-customization-popover-1778052240.png",
      "isPrimary": false,
      "isFailureProof": false
    },
    {
      "kind": "screenshot",
      "path": "macos_customization_save_rollback_smoke/02-customization-popover-1778052240_annotated.png",
      "url": null,
      "thumbnailUrl": null,
      "timestampMs": null,
      "phase": "macos-e2e",
      "caption": "02-customization-popover-1778052240_annotated.png",
      "isPrimary": false,
      "isFailureProof": false
    },
    {
      "kind": "screenshot",
      "path": "macos_customization_save_rollback_smoke/03-customization-review-1778052247.png",
      "url": null,
      "thumbnailUrl": null,
      "timestampMs": null,
      "phase": "macos-e2e",
      "caption": "03-customization-review-1778052247.png",
      "isPrimary": false,
      "isFailureProof": false
    },
    {
      "kind": "screenshot",
      "path": "macos_customization_save_rollback_smoke/03-customization-review-1778052247_annotated.png",
      "url": null,
      "thumbnailUrl": null,
      "timestampMs": null,
      "phase": "macos-e2e",
      "caption": "03-customization-review-1778052247_annotated.png",
      "isPrimary": false,
      "isFailureProof": false
    },
    {
      "kind": "screenshot",
      "path": "macos_customization_save_rollback_smoke/04-customization-save-step-after-build-1778052265.png",
      "url": null,
      "thumbnailUrl": null,
      "timestampMs": null,
      "phase": "macos-e2e",
      "caption": "04-customization-save-step-after-build-1778052265.png",
      "isPrimary": false,
      "isFailureProof": false
    },
    {
      "kind": "screenshot",
      "path": "macos_customization_save_rollback_smoke/04-customization-save-step-after-build-1778052265_annotated.png",
      "url": null,
      "thumbnailUrl": null,
      "timestampMs": null,
      "phase": "macos-e2e",
      "caption": "04-customization-save-step-after-build-1778052265_annotated.png",
      "isPrimary": false,
      "isFailureProof": false
    },
    {
      "kind": "screenshot",
      "path": "macos_customization_save_rollback_smoke/05-customization-returned-to-describe-1778052270.png",
      "url": null,
      "thumbnailUrl": null,
      "timestampMs": null,
      "phase": "macos-e2e",
      "caption": "05-customization-returned-to-describe-1778052270.png",
      "isPrimary": false,
      "isFailureProof": false
    },
    {
      "kind": "screenshot",
      "path": "macos_customization_save_rollback_smoke/05-customization-returned-to-describe-1778052270_annotated.png",
      "url": null,
      "thumbnailUrl": null,
      "timestampMs": null,
      "phase": "macos-e2e",
      "caption": "05-customization-returned-to-describe-1778052270_annotated.png",
      "isPrimary": false,
      "isFailureProof": false
    },
    {
      "kind": "screenshot",
      "path": "macos_customization_save_rollback_smoke/06-history-before-restore-1778052273.png",
      "url": null,
      "thumbnailUrl": null,
      "timestampMs": null,
      "phase": "macos-e2e",
      "caption": "06-history-before-restore-1778052273.png",
      "isPrimary": false,
      "isFailureProof": false
    },
    {
      "kind": "screenshot",
      "path": "macos_customization_save_rollback_smoke/06-history-before-restore-1778052273_annotated.png",
      "url": null,
      "thumbnailUrl": null,
      "timestampMs": null,
      "phase": "macos-e2e",
      "caption": "06-history-before-restore-1778052273_annotated.png",
      "isPrimary": false,
      "isFailureProof": false
    },
    {
      "kind": "screenshot",
      "path": "macos_customization_save_rollback_smoke/07-history-restore-preview-1778052276.png",
      "url": null,
      "thumbnailUrl": null,
      "timestampMs": null,
      "phase": "macos-e2e",
      "caption": "07-history-restore-preview-1778052276.png",
      "isPrimary": false,
      "isFailureProof": false
    },
    {
      "kind": "screenshot",
      "path": "macos_customization_save_rollback_smoke/07-history-restore-preview-1778052276_annotated.png",
      "url": null,
      "thumbnailUrl": null,
      "timestampMs": null,
      "phase": "macos-e2e",
      "caption": "07-history-restore-preview-1778052276_annotated.png",
      "isPrimary": false,
      "isFailureProof": false
    },
    {
      "kind": "screenshot",
      "path": "macos_customization_save_rollback_smoke/failure-1778052303-1778052303.png",
      "url": null,
      "thumbnailUrl": null,
      "timestampMs": null,
      "phase": "macos-e2e",
      "caption": "failure-1778052303-1778052303.png",
      "isPrimary": false,
      "isFailureProof": true
    },
    {
      "kind": "screenshot",
      "path": "macos_customization_save_rollback_smoke/failure-1778052303-1778052303_annotated.png",
      "url": null,
      "thumbnailUrl": null,
      "timestampMs": null,
      "phase": "macos-e2e",
      "caption": "failure-1778052303-1778052303_annotated.png",
      "isPrimary": false,
      "isFailureProof": true
    },
    {
      "kind": "video",
      "path": "macos_customization_save_rollback_smoke/peekaboo-e2e.mp4",
      "url": null,
      "thumbnailUrl": null,
      "timestampMs": null,
      "phase": "macos-e2e",
      "caption": "Full screen recording",
      "isPrimary": true,
      "isFailureProof": true
    }
  ]
}
