{
  "schemaVersion": 1,
  "repo": "darkmatter/nixmac",
  "prNumber": null,
  "headSha": "unknown",
  "baseSha": null,
  "workflowRunId": null,
  "attempt": null,
  "lane": "peekaboo-local",
  "scenario": "macos_provider_discard_smoke",
  "runnerId": "macos-e2e",
  "runnerKind": "peekaboo-local",
  "startedAt": "2026-05-06T07:27:24Z",
  "finishedAt": "2026-05-06T07:29:59Z",
  "durationMs": 155000,
  "status": "failed",
  "htmlReportUrl": null,
  "primaryProofUrl": "macos_provider_discard_smoke/peekaboo-e2e.mp4",
  "failureProofUrl": "macos_provider_discard_smoke/failure-1778052576-1778052576.png",
  "failureScreenshotUrl": "macos_provider_discard_smoke/failure-1778052576-1778052576.png",
  "failureVideoUrl": "macos_provider_discard_smoke/peekaboo-e2e.mp4",
  "failureTimestampMs": null,
  "replayCommand": "tests/e2e/run.sh macos_provider_discard_smoke",
  "localReproCommand": "tests/e2e/run.sh macos_provider_discard_smoke",
  "phases": [
    {
      "name": "peekabooProviderFixture: Prepared discard config repo, deterministic HTTP provider, completion logging, and mock rebuild flag",
      "status": "passed",
      "startedAt": null,
      "finishedAt": null,
      "durationMs": 0,
      "assertions": [
        "peekabooProviderFixture: Prepared discard config repo, deterministic HTTP provider, completion logging, and mock rebuild flag"
      ],
      "proof": [],
      "error": null
    },
    {
      "name": "peekabooProviderLaunch: App launched for discard proof",
      "status": "passed",
      "startedAt": null,
      "finishedAt": null,
      "durationMs": 0,
      "assertions": [
        "peekabooProviderLaunch: App launched for discard proof"
      ],
      "proof": [],
      "error": null
    },
    {
      "name": "peekabooProviderTypedIntent: Descriptor submitted for discard proof",
      "status": "passed",
      "startedAt": null,
      "finishedAt": null,
      "durationMs": 0,
      "assertions": [
        "peekabooProviderTypedIntent: Descriptor submitted for discard proof"
      ],
      "proof": [],
      "error": null
    },
    {
      "name": "peekabooProviderReview: Provider calls observed and Review step reached for discard proof",
      "status": "passed",
      "startedAt": null,
      "finishedAt": null,
      "durationMs": 0,
      "assertions": [
        "peekabooProviderReview: Provider calls observed and Review step reached for discard proof"
      ],
      "proof": [],
      "error": null
    },
    {
      "name": "Discard supersession could not commit generated changes",
      "status": "failed",
      "startedAt": null,
      "finishedAt": null,
      "durationMs": 0,
      "assertions": [
        "Discard supersession could not commit generated changes"
      ],
      "proof": [],
      "error": "Discard supersession could not commit generated changes"
    }
  ],
  "captureLimitations": [],
  "proof": [
    {
      "kind": "screenshot",
      "path": "macos_provider_discard_smoke/01-discard-launched-1778052478.png",
      "url": null,
      "thumbnailUrl": null,
      "timestampMs": null,
      "phase": "macos-e2e",
      "caption": "01-discard-launched-1778052478.png",
      "isPrimary": false,
      "isFailureProof": false
    },
    {
      "kind": "screenshot",
      "path": "macos_provider_discard_smoke/01-discard-launched-1778052478_annotated.png",
      "url": null,
      "thumbnailUrl": null,
      "timestampMs": null,
      "phase": "macos-e2e",
      "caption": "01-discard-launched-1778052478_annotated.png",
      "isPrimary": false,
      "isFailureProof": false
    },
    {
      "kind": "screenshot",
      "path": "macos_provider_discard_smoke/02-discard-descriptor-typed-1778052495.png",
      "url": null,
      "thumbnailUrl": null,
      "timestampMs": null,
      "phase": "macos-e2e",
      "caption": "02-discard-descriptor-typed-1778052495.png",
      "isPrimary": false,
      "isFailureProof": false
    },
    {
      "kind": "screenshot",
      "path": "macos_provider_discard_smoke/02-discard-descriptor-typed-1778052495_annotated.png",
      "url": null,
      "thumbnailUrl": null,
      "timestampMs": null,
      "phase": "macos-e2e",
      "caption": "02-discard-descriptor-typed-1778052495_annotated.png",
      "isPrimary": false,
      "isFailureProof": false
    },
    {
      "kind": "screenshot",
      "path": "macos_provider_discard_smoke/03-discard-review-provider-evolved-1778052497.png",
      "url": null,
      "thumbnailUrl": null,
      "timestampMs": null,
      "phase": "macos-e2e",
      "caption": "03-discard-review-provider-evolved-1778052497.png",
      "isPrimary": false,
      "isFailureProof": false
    },
    {
      "kind": "screenshot",
      "path": "macos_provider_discard_smoke/03-discard-review-provider-evolved-1778052497_annotated.png",
      "url": null,
      "thumbnailUrl": null,
      "timestampMs": null,
      "phase": "macos-e2e",
      "caption": "03-discard-review-provider-evolved-1778052497_annotated.png",
      "isPrimary": false,
      "isFailureProof": false
    },
    {
      "kind": "screenshot",
      "path": "macos_provider_discard_smoke/04-discard-ready-1778052501.png",
      "url": null,
      "thumbnailUrl": null,
      "timestampMs": null,
      "phase": "macos-e2e",
      "caption": "04-discard-ready-1778052501.png",
      "isPrimary": false,
      "isFailureProof": false
    },
    {
      "kind": "screenshot",
      "path": "macos_provider_discard_smoke/04-discard-ready-1778052501_annotated.png",
      "url": null,
      "thumbnailUrl": null,
      "timestampMs": null,
      "phase": "macos-e2e",
      "caption": "04-discard-ready-1778052501_annotated.png",
      "isPrimary": false,
      "isFailureProof": false
    },
    {
      "kind": "screenshot",
      "path": "macos_provider_discard_smoke/discard-confirmation-missing-1778052558.png",
      "url": null,
      "thumbnailUrl": null,
      "timestampMs": null,
      "phase": "macos-e2e",
      "caption": "discard-confirmation-missing-1778052558.png",
      "isPrimary": false,
      "isFailureProof": false
    },
    {
      "kind": "screenshot",
      "path": "macos_provider_discard_smoke/discard-confirmation-missing-1778052558_annotated.png",
      "url": null,
      "thumbnailUrl": null,
      "timestampMs": null,
      "phase": "macos-e2e",
      "caption": "discard-confirmation-missing-1778052558_annotated.png",
      "isPrimary": false,
      "isFailureProof": false
    },
    {
      "kind": "screenshot",
      "path": "macos_provider_discard_smoke/failure-1778052576-1778052576.png",
      "url": null,
      "thumbnailUrl": null,
      "timestampMs": null,
      "phase": "macos-e2e",
      "caption": "failure-1778052576-1778052576.png",
      "isPrimary": false,
      "isFailureProof": true
    },
    {
      "kind": "screenshot",
      "path": "macos_provider_discard_smoke/failure-1778052576-1778052576_annotated.png",
      "url": null,
      "thumbnailUrl": null,
      "timestampMs": null,
      "phase": "macos-e2e",
      "caption": "failure-1778052576-1778052576_annotated.png",
      "isPrimary": false,
      "isFailureProof": true
    },
    {
      "kind": "video",
      "path": "macos_provider_discard_smoke/peekaboo-e2e.mp4",
      "url": null,
      "thumbnailUrl": null,
      "timestampMs": null,
      "phase": "macos-e2e",
      "caption": "Full screen recording",
      "isPrimary": true,
      "isFailureProof": true
    }
  ]
}
