{
  "schemaVersion": 1,
  "repo": "darkmatter/nixmac",
  "prNumber": null,
  "headSha": "unknown",
  "baseSha": null,
  "workflowRunId": null,
  "attempt": null,
  "lane": "peekaboo-local",
  "scenario": "macos_homebrew_save_rollback_smoke",
  "runnerId": "macos-e2e",
  "runnerKind": "peekaboo-local",
  "startedAt": "2026-05-06T05:02:56Z",
  "finishedAt": "2026-05-06T05:04:50Z",
  "durationMs": 114000,
  "status": "failed",
  "htmlReportUrl": null,
  "primaryProofUrl": "macos_homebrew_save_rollback_smoke/peekaboo-e2e.mp4",
  "failureProofUrl": "macos_homebrew_save_rollback_smoke/failure-1778043870-1778043870.png",
  "failureScreenshotUrl": "macos_homebrew_save_rollback_smoke/failure-1778043870-1778043870.png",
  "failureVideoUrl": "macos_homebrew_save_rollback_smoke/peekaboo-e2e.mp4",
  "failureTimestampMs": null,
  "replayCommand": "tests/e2e/run.sh macos_homebrew_save_rollback_smoke",
  "localReproCommand": "tests/e2e/run.sh macos_homebrew_save_rollback_smoke",
  "phases": [
    {
      "name": "peekabooProviderFixture: Prepared Homebrew managed-badge fixture, deterministic HTTP provider, completion logging, and mock rebuild flag",
      "status": "passed",
      "startedAt": null,
      "finishedAt": null,
      "durationMs": 0,
      "assertions": [
        "peekabooProviderFixture: Prepared Homebrew managed-badge fixture, deterministic HTTP provider, completion logging, and mock rebuild flag"
      ],
      "proof": [],
      "error": null
    },
    {
      "name": "peekabooProviderLaunch: App launched for Untracked Homebrew items proof",
      "status": "passed",
      "startedAt": null,
      "finishedAt": null,
      "durationMs": 0,
      "assertions": [
        "peekabooProviderLaunch: App launched for Untracked Homebrew items proof"
      ],
      "proof": [],
      "error": null
    },
    {
      "name": "peekabooProviderBuildBoundary: Build & Test advanced to Save step for Untracked Homebrew items",
      "status": "passed",
      "startedAt": null,
      "finishedAt": null,
      "durationMs": 0,
      "assertions": [
        "peekabooProviderBuildBoundary: Build & Test advanced to Save step for Untracked Homebrew items"
      ],
      "proof": [],
      "error": null
    },
    {
      "name": "peekabooProviderSaveFlow: Untracked Homebrew items Save step committed changes and returned to Describe",
      "status": "passed",
      "startedAt": null,
      "finishedAt": null,
      "durationMs": 0,
      "assertions": [
        "peekabooProviderSaveFlow: Untracked Homebrew items Save step committed changes and returned to Describe"
      ],
      "proof": [],
      "error": null
    },
    {
      "name": "Untracked Homebrew items History restore did not return disposable config repo to baseline",
      "status": "failed",
      "startedAt": null,
      "finishedAt": null,
      "durationMs": 0,
      "assertions": [
        "Untracked Homebrew items History restore did not return disposable config repo to baseline"
      ],
      "proof": [],
      "error": "Untracked Homebrew items History restore did not return disposable config repo to baseline"
    }
  ],
  "captureLimitations": [],
  "proof": [
    {
      "kind": "screenshot",
      "path": "macos_homebrew_save_rollback_smoke/01-homebrew-launched-1778043808.png",
      "url": null,
      "thumbnailUrl": null,
      "timestampMs": null,
      "phase": "macos-e2e",
      "caption": "01-homebrew-launched-1778043808.png",
      "isPrimary": false,
      "isFailureProof": false
    },
    {
      "kind": "screenshot",
      "path": "macos_homebrew_save_rollback_smoke/01-homebrew-launched-1778043808_annotated.png",
      "url": null,
      "thumbnailUrl": null,
      "timestampMs": null,
      "phase": "macos-e2e",
      "caption": "01-homebrew-launched-1778043808_annotated.png",
      "isPrimary": false,
      "isFailureProof": false
    },
    {
      "kind": "screenshot",
      "path": "macos_homebrew_save_rollback_smoke/02-homebrew-popover-1778043814.png",
      "url": null,
      "thumbnailUrl": null,
      "timestampMs": null,
      "phase": "macos-e2e",
      "caption": "02-homebrew-popover-1778043814.png",
      "isPrimary": false,
      "isFailureProof": false
    },
    {
      "kind": "screenshot",
      "path": "macos_homebrew_save_rollback_smoke/02-homebrew-popover-1778043814_annotated.png",
      "url": null,
      "thumbnailUrl": null,
      "timestampMs": null,
      "phase": "macos-e2e",
      "caption": "02-homebrew-popover-1778043814_annotated.png",
      "isPrimary": false,
      "isFailureProof": false
    },
    {
      "kind": "screenshot",
      "path": "macos_homebrew_save_rollback_smoke/03-homebrew-review-1778043820.png",
      "url": null,
      "thumbnailUrl": null,
      "timestampMs": null,
      "phase": "macos-e2e",
      "caption": "03-homebrew-review-1778043820.png",
      "isPrimary": false,
      "isFailureProof": false
    },
    {
      "kind": "screenshot",
      "path": "macos_homebrew_save_rollback_smoke/03-homebrew-review-1778043820_annotated.png",
      "url": null,
      "thumbnailUrl": null,
      "timestampMs": null,
      "phase": "macos-e2e",
      "caption": "03-homebrew-review-1778043820_annotated.png",
      "isPrimary": false,
      "isFailureProof": false
    },
    {
      "kind": "screenshot",
      "path": "macos_homebrew_save_rollback_smoke/04-homebrew-save-step-after-build-1778043838.png",
      "url": null,
      "thumbnailUrl": null,
      "timestampMs": null,
      "phase": "macos-e2e",
      "caption": "04-homebrew-save-step-after-build-1778043838.png",
      "isPrimary": false,
      "isFailureProof": false
    },
    {
      "kind": "screenshot",
      "path": "macos_homebrew_save_rollback_smoke/04-homebrew-save-step-after-build-1778043838_annotated.png",
      "url": null,
      "thumbnailUrl": null,
      "timestampMs": null,
      "phase": "macos-e2e",
      "caption": "04-homebrew-save-step-after-build-1778043838_annotated.png",
      "isPrimary": false,
      "isFailureProof": false
    },
    {
      "kind": "screenshot",
      "path": "macos_homebrew_save_rollback_smoke/05-homebrew-returned-to-describe-1778043843.png",
      "url": null,
      "thumbnailUrl": null,
      "timestampMs": null,
      "phase": "macos-e2e",
      "caption": "05-homebrew-returned-to-describe-1778043843.png",
      "isPrimary": false,
      "isFailureProof": false
    },
    {
      "kind": "screenshot",
      "path": "macos_homebrew_save_rollback_smoke/05-homebrew-returned-to-describe-1778043843_annotated.png",
      "url": null,
      "thumbnailUrl": null,
      "timestampMs": null,
      "phase": "macos-e2e",
      "caption": "05-homebrew-returned-to-describe-1778043843_annotated.png",
      "isPrimary": false,
      "isFailureProof": false
    },
    {
      "kind": "screenshot",
      "path": "macos_homebrew_save_rollback_smoke/06-history-before-restore-1778043846.png",
      "url": null,
      "thumbnailUrl": null,
      "timestampMs": null,
      "phase": "macos-e2e",
      "caption": "06-history-before-restore-1778043846.png",
      "isPrimary": false,
      "isFailureProof": false
    },
    {
      "kind": "screenshot",
      "path": "macos_homebrew_save_rollback_smoke/06-history-before-restore-1778043846_annotated.png",
      "url": null,
      "thumbnailUrl": null,
      "timestampMs": null,
      "phase": "macos-e2e",
      "caption": "06-history-before-restore-1778043846_annotated.png",
      "isPrimary": false,
      "isFailureProof": false
    },
    {
      "kind": "screenshot",
      "path": "macos_homebrew_save_rollback_smoke/07-history-restore-preview-1778043849.png",
      "url": null,
      "thumbnailUrl": null,
      "timestampMs": null,
      "phase": "macos-e2e",
      "caption": "07-history-restore-preview-1778043849.png",
      "isPrimary": false,
      "isFailureProof": false
    },
    {
      "kind": "screenshot",
      "path": "macos_homebrew_save_rollback_smoke/07-history-restore-preview-1778043849_annotated.png",
      "url": null,
      "thumbnailUrl": null,
      "timestampMs": null,
      "phase": "macos-e2e",
      "caption": "07-history-restore-preview-1778043849_annotated.png",
      "isPrimary": false,
      "isFailureProof": false
    },
    {
      "kind": "screenshot",
      "path": "macos_homebrew_save_rollback_smoke/failure-1778043870-1778043870.png",
      "url": null,
      "thumbnailUrl": null,
      "timestampMs": null,
      "phase": "macos-e2e",
      "caption": "failure-1778043870-1778043870.png",
      "isPrimary": false,
      "isFailureProof": true
    },
    {
      "kind": "screenshot",
      "path": "macos_homebrew_save_rollback_smoke/failure-1778043870-1778043870_annotated.png",
      "url": null,
      "thumbnailUrl": null,
      "timestampMs": null,
      "phase": "macos-e2e",
      "caption": "failure-1778043870-1778043870_annotated.png",
      "isPrimary": false,
      "isFailureProof": true
    },
    {
      "kind": "video",
      "path": "macos_homebrew_save_rollback_smoke/peekaboo-e2e.mp4",
      "url": null,
      "thumbnailUrl": null,
      "timestampMs": null,
      "phase": "macos-e2e",
      "caption": "Full screen recording",
      "isPrimary": true,
      "isFailureProof": true
    }
  ]
}
